{
  "schema_version": 1,
  "video_id": "match_001",
  "filename": "match_001.mp4",
  "sha256": "71d58558559d6f578433ce9f234bf176f76fd5a86657dbfe3eba1e7d36136b06",
  "duration_sec": 171.019336,
  "width": 1920,
  "height": 1080,
  "fps": 60.0,
  "audio_tracks": 3,
  "validation_pack": "valorant_e2e_validation_pack_v3",
  "validation_pack_sha256": "71b8021e21d4796a32e7c09327c38ec83cb4645ad6d3f78a1823ecb53970359d",
  "assertions_sha256": "c5e242b611ce227d1d2633e5e24c00dfe65168d8124ab58fbdea84b1d7f0d820"
}
